{
  "$schema": "./scenario.schema.json",
  "name": "a11y-checker-contrast-cut",
  "title": "a11y-checker — the bugs your linter misses, inside your design system",
  "output": "contrast",
  "terminal": {
    "width": 1200,
    "height": 760,
    "theme": "Catppuccin Mocha",
    "fontSize": 16,
    "typingSpeed": "45ms",
    "padding": 18
  },
  "workdir": ".",
  "shellInit": ["source demo/_a11y.sh"],
  "setup": [],
  "teardown": [],
  "acts": [
    {
      "title": "ACT 1 — same file, two linters: 1 of 3 vs 3 of 3",
      "steps": [
        {
          "say": [
            "A normal MUI toolbar. An icon-only IconButton, a placeholder-only TextField,",
            "a correct Button, and one img. Three of these are real accessibility bugs."
          ],
          "run": "cat demo/contrast/Toolbar.tsx",
          "expect": {
            "exit": 0,
            "stdoutContains": ["IconButton", "TextField", "<Button>Save</Button>", "img"]
          },
          "read": 4
        },
        {
          "say": [
            "The industry-standard a11y linter — eslint-plugin-jsx-a11y, recommended.",
            "1 problem. It thinks you're basically fine."
          ],
          "run": "npx eslint --no-config-lookup --config demo/contrast/eslint.config.mjs demo/contrast/Toolbar.tsx",
          "expect": {
            "exit": 1,
            "stdoutContains": ["jsx-a11y/alt-text", "1 problem"],
            "stdoutNotContains": ["button-no-name", "input-no-name"]
          },
          "read": 4
        },
        {
          "say": [
            "a11y-checker — 3. The two your linter missed are inside MUI, where it can't look:",
            "a button screen readers can't name (4.1.2), a field with no label (1.3.1). With the fix."
          ],
          "run": "a11y scan demo/contrast",
          "expect": {
            "exit": 1,
            "stdoutContains": [
              "jsx-a11y/alt-text",
              "enforce/button-no-name",
              "enforce/input-no-name",
              "fix:",
              "3 finding(s)"
            ],
            "stdoutNotContains": ["ENOENT"]
          },
          "read": 5
        },
        {
          "say": [
            "Same file: your linter caught 1 of 3. The 2 it missed are the ones that actually",
            "break the experience — and they're inside your design system."
          ],
          "run": "echo 'eslint: 1 of 3   ·   a11y-checker: 3 of 3   ·   zero false positives on <Button>Save</Button>'",
          "expect": {
            "exit": 0,
            "stdoutContains": ["1 of 3", "3 of 3"]
          },
          "read": 4
        }
      ]
    }
  ]
}
